ID,Sexual_Orientation,Sexual_Orientation_Description
111000,Asexual,Not sexually attracted to anyone.
111001,Aromantic,Not romantically attracted to anyone.
111002,Straight,Attracted to the sex/gender opposite their own on the spectrum.
111003,Demisexual,"Doesn't experience sexual attraction to someone unless they have a deep, emotional connection with them."
111004,Gay,Describes a man whose sexual orientation is primarily geared towards other men.
111005,Lesbian,Describes a woman whose sexual orientation is primarily geared towards other women.
111006,Bisexual,Attracted to more than one gender or gender identity.
111007,Pansexual,"Attracted to the person rather than their sex, gender, or gender identity."